3.0;Een onconventionele documentaire over een Frans-Vlaamse encyclopedist die de mystiek en het dagelijks leven van West-Afrika wil vastleggen.;N: The Madness of Reason
2.5;Hoe onderscheidt de eerste Vlaamse Sinterklaasfilm zich van zijn Nederlandse tegenhanger?;Ramon en het Paard van Sinterklaas
5.0;Deze 'Netflix Original' draait niet in de bioscoop, maar is alleen te zien bij de populaire streamingdienst. Idris Elba is fenomenaal in dit aangrijpende verhaal over kindsoldaten.;Beasts of No Nation
5.0;Een immens Engels landhuis zucht, steunt en bloedt onder haar bewoners. Het is het belangrijkste personage in een visueel overdonderend meesterwerkje van Guillermo del Toro.;Crimson Peak
4.5;Johnny Depp doet zijn status als topacteur eindelijk weer eens eer aan. Hij kruipt in de huid van gangster James 'Whitey' Bulger die met FBI-steun de baas van South Boston kon zijn.;Black Mass
2.5;Er is heel veel aan de hand in het leven van puber Jimmy, die gedwongen wordt snel volwassen te worden. Regisseur Claudel schept weinig orde in de chaos.;Une Enfance
3.5;Jong, verliefd, zwanger, maar Maria heeft allesbehalve een droomleven in haar geïsoleerde Maya-dorpje.;Ixcanul
3.5;Albanees drama over identiteit in het keurslijf van een eeuwenoude subcultuur in Oost-Europa.;Sworn Virgin
3.5;Apengekrijs dat zowel afschuwelijk als vertederend is.;Marguerite
3.5;Leo is een elfjarige jongen die een zware behandeling in het ziekenhuis moet ondergaan. Hij kan echter uit zijn lichaam treden en zo boeven opsporen.;Phantom Boy
4.0;Koorddansen tussen de Twin Towers in duizelingwekkend 3D.;The Walk
3.0;Anton Corbijn is de dupe geworden van een weifelend scenario. Het is niet helemaal duidelijk of Life nu om James Dean draait of om de fotograaf die de rijzende ster moet vastleggen.;Life
4.5;Villeneuve schiet opnieuw met scherp.;Sicario
2.5;Een originele invalshoek. Wat doen we als we kennismaken met een buitenaardse beschaving? Geleerden en politici gaan er bloedserieus op in.;The Visit: An Alien Encounter
3.0;De gruwelen van de Tweede Wereldoorlog kunnen zelfs doorwerken in naoorlogse generaties.;LChaim!  To Life!
3.5;Zo mooi gemaakt dat het enigszins ongeïnspireerde verhaal nauwelijks stoort.;Pan
2.5;Dracula is terug bij af in dit wat onderontwikkelde vervolg.;Hotel Transylvania 2
1.5;Het definitieve afscheid van Bassie en Adriaan is een flinke deceptie. Hun opvolgers zullen het niet zo lang volhouden.;Keet & Koen en de Speurtocht Naar Bassie en Adriaan
4.0;Matt Damon schittert als een Robinson Crusoe in de kosmos in de nieuwe spektakelfilm van Ridley Scott.;The Martian
4.0;Over vijf ongetemde meiden vol vechtlust tegen onderdrukking.;Mustang
3.5;Wild, vervreemdend, vet aangezet. Het zit allemaal op het randje, maar dat maakt deze boekverfilming ook zo vermakelijk.;J. Kessels
2.0;Yusuke is zo dood als een pier, maar staat op een avond in de keuken van zijn vrouw. Samen gaan ze op reis naar de kust, waar ze de afgelopen drie jaar reconstrueren.;Journey to the Shore
3.0;Een slap aftreksel van Frozen? Deze animatiefilm is beter dan je op het eerste gezicht zou denken.;De Sneeuwkoningin 2
3.0;Zeg maar dag tegen Jason Statham en verwelkom Ed Skrein als uw nieuwe Transporter.;The Transporter Refueled
3.5;Mooie beelden bewijzen dat we ook in Nederland bijzondere natuur hebben.;Holland: Natuur in de Delta
3.5;Gepensioneerde Robert De Niro gaat stage lopen bij carrièrevrouw Anne Hathaway in aangename feelgoodfilm van Nancy Meyers.;The Intern
3.5;Mario Donckers is een nukkige buschauffeur die voor zijn pensioen een laatste klus accepteert. Gezellig met zijn zoon waarmee hij het contact heeft verbroken naar een hippiefestival in Kroatië.;Paradise Trips
4.5;Een tergend pijnlijke, maar beeldschone ontleding van een schijnbaar perfect huwelijk.;45 Years
3.5;Bedachtzaam portret van een ontluikende liefde.;Félix & Meira
2.0;Sfeervolle shots zijn er genoeg. Maar Terrence Malick lijkt hoe langer hoe minder rekening te houden met zowel cast als publiek.;Knight of Cups
4.0;Zeer aangrijpend drama met wortels in de werkelijkheid.;The Lesson
3.5;Een barre trektocht naar het topje van de wereld.;Everest
3.5;Debuutfilm van MacLean met een leuke rol van Michael Fassbender is een fijne mix van western, komedie en thriller.;Slow West
3.5;Het middendeel van de Maze Runner trilogie strijkt een aantal plooien van het eerste deel glad, maar maakt ook weer nieuwe kreukels.;Maze Runner: The Scorch Trials
3.5;Een nieuw aangestelde huishoudster belandt in een driehoeksverhouding met vader en tienerdochter.;Underdog
2.5;Een zwangere moeder en haar zoon zijn op de vlucht voor een echtnoot annex vader met losse handjes.;Refugiado
3.5;De Letse Andris Nelsons maakt een uitstapje naar Amsterdam om het Koninklijk Concertgebouworkest te dirigeren in de uitvoering van de vijfde symfonie van Sjostakovitsj.;Nelsons N°5
2.5;M. Night Shyamalans nieuwste is een aardige opsteker na zijn laatste paar films, maar helaas nog lang geen terugkeer naar zijn oude niveau.;The Visit
3.0;Jake Gyllenhaal heeft hard geknokt om een aan lager wal geraakte bokser te vertolken, maar die inspanning wordt niet beloond met een creatief en diepgravend scenario.;Southpaw
2.0;Jeroen van Koningsbrugge heeft betere dramatische rollen gespeeld dan die van een drugsvader met een vet Amsterdams accent.;Schone Handen
4.0;Ethan Hawke maakte een intiem en inspirerend portret over pianoleraar Seymour Bernstein.;Seymour: An Introduction
4.0;Intrigerende documentaire over zeven kinderen die jaren niet buiten kwamen en de wereld enkel kenden uit films.;The Wolfpack
2.0;Een familievakantie verandert al snel in een bizarre roadtrip in deze remake met Ed Helms.;Vacation
1.5;Het maken van een geslaagde videogameverfilming blijkt nog altijd een lastige opgave.;Hitman: Agent 47
4.0;De biografie rondom één van de invloedrijkste hiphopformaties kijkt weg als een jongensboek met een vleugje maatschappijkritiek.;Straight Outta Compton
3.5;Boeiend, gewelddadig immigratiedrama dat de Gouden Palm in Cannes won.;Dheepan
1.5;Eli Roths nieuwste kan het beste worden omschreven als de pornoversie van Funny Games.;Knock Knock
3.0;Ontroerend verhaal, deels tenietgedaan door de zeer onevenwichtige toon.;Mia Madre
2.0;Deze belegen muzikale feelgoodfilm richt zijn pijlen voornamelijk op het oudere publiek. Zelfs met Meryl Streep als rockchick levert dat een slaapverwekkende kijkervaring op.;Ricki and the Flash
4.5;Eén shot van ruim twee uur sleurt de kijker mee door nachtelijk Berlijn. Niet alleen technisch indrukwekkend, maar ook zeer beklemmend en aangrijpend.;Victoria
3.5;De eerste speelfilm van en met Amy Schumer is op momenten hilarisch, maar romantiek maakt soms meer kapot dan haar lief is.;Trainwreck
3.5;Bijzonder afstudeerproject volgt drie Amsterdammers een jaar lang terwijl ze door de stad wandelen.;Een Dag in 't Jaar
3.0;Chaotische actiekomedie waarin stoner Jesse Eisenberg de ultieme vechtmachine blijkt te zijn.;American Ultra
2.5;De rijke historie van de voornaamste bioscoop van België die een toevluchtsoord werd voor illegale immigranten komt in deze docu niet helemaal lekker uit de verf.;Carnotstraat 17
2.5;Wie volledig uit zijn plaat wil gaan op de beats van Zac Efron is aan het juiste adres, maar inhoudelijk heeft deze succestocht van een aspirerend dj weinig te bieden.;We Are Your Friends
1.5;Een moderne Kazachse bewerking van de klassieke roman Misdaad en Straf van Dostojevski. Rommelig en slordig uitgewerkt.;Stoedjent
3.0;Nathan is autistisch, heeft een wiskundeknobbel en vlinders in zijn buik. Een ongelukkige combinatie die al even ongelukkig wordt verbeeld.;X + Y
3.0;Viggo Mortensen gaat op een lange zoektocht naar zijn dochter in deze arthousewestern.;Jauja
2.0;Op de tekentafel lijkt een buitenaardse aanval door personages uit klassieke arcadegames veelbelovend. Chris Columbus maakt er echter een genadeloze 'game over' van.;Pixels
3.0;Henry Cavill en Armie Hammer bundelen de krachten in deze stijlvolle, doch ietwat oppervlakkige 60s-revival.;The Man From U.N.C.L.E.
2.5;Een geslaagd idee hoeft nog geen geslaagd levenswerk te betekenen. Niet als je Abe Lucas bent, maar ook niet noodzakelijkerwijs als je Woody Allen heet.;Irrational Man
3.5;Met een sterk verhaal en een griezelige sfeer is Sinister 2 het zeldzame horrorvervolg dat beter is dan zijn voorganger.;Sinister 2
2.5;De zoektocht naar de perfecte horrorschreeuw mondt uit in een wirwar van perspectieven, invalshoeken en geklooi met de chronologie en parallelle werkelijkheden.;Réalité
4.0;Minnie is een bijzondere tiener met een goed stel hersens en een brok talent. Liefde en lust voor de vriend van haar moeder brengen haar uit balans.;The Diary of a Teenage Girl
1.0;Ted 2 is eigenlijk het ergste wat een komedie kan zijn.;Ted 2
4.0;Geweldige, meeslepende avonturenfilm van debuterend speelfilmregisseur Naji Abu Nowar.;Theeb
2.5;Debuterend regisseur Victor Levin doet een poging om Woody Allen na te doen.;5 to 7
3.5;Indringende documentaire over het leven van Amy Winehouse, die naast de tragiek ook haar muzikale talent benadrukt.;Amy
2.0;Een reboot van de Fantastic Four? Doe maar niet;Fantastic Four
4.0;Het woord dope heeft grofweg drie betekenissen: drugs, sufferd en gaaf. Opvallend genoeg zijn deze alle drie van toepassing op de gelijknamige film.;Dope
4.5;Prachtige klassieker van Alain Resnais met tijdloze thema' s als onmogelijke liefde, verlies en verwerking.;Hiroshima Mon Amour
2.5;Er loopt veel acteertalent rond in de verfilming van het tweede boek van Gone Girl-schrijfster Gillian Flynn, maar het scenario doet daar weinig recht aan.;Dark Places
2.0;Tweede verfilming van de misdaadreeks over inspecteur Mørck en zijn onopgeloste zaakjes. Een dubbele moord leidt veel te snel naar een kostschool en rijke stinkerds.;De Fazantenmoordenaars
3.5;Nicole probeert de dagen van haar zomervakantie te vullen, maar stuit daarbij op enorme ladingen aan desillusie, apathie en verveling.;Tu Dors Nicole
2.0;Aleksei Germans laatste film schept een krachtige sfeer, maar heeft verder weinig te bieden.;Hard to Be a God
3.0;Frans komediedrama dat zijn clichématige verhaaltje gecompenseerd met een hoop hart en humor.;Les Souvenirs
4.0;Mooi drama waarin jonge mensen proberen te ontsnappen aan de oude patronen van de Indiase samenleving.;Masaan
2.5;Oostenrijker Ulrich Seidl maakt het je nou nooit eens lekker comfortabel. Dat geldt zeker voor deze ongemakkelijke docu over de geheimen van de Oostenrijkse keldercultuur.;Im Keller
2.5;Vervolg op Comment Je Me Suis Disputé (Ma Vie Sexuelle) van twintig jaar geleden dat zich richt op drie bepalende periodes in het leven van antropoloog en intellectueel Paul.;Trois Souvenirs de Ma Jeunesse
4.0;Cruise en co leveren weer heerlijk ouderwets vermaak af in een verhaal dat puur dient om hen van spektakel naar spektakel te voeren.;Mission: Impossible - Rogue Nation
4.0;Een bijzonder Brits kostuumdrama over racisme, slavernij én feminisme, met een mooie hoofdrol voor een zwarte vrouw.;Belle
3.5;Zolang de economische crisis films oplevert als dit integere drama kan zij zo erg toch niet zijn?;La Loi du Marché
4.0;Fijnzinnige tragikomedie over ouder en/of volwassen worden.;While We're Young
4.0;De levenslessen van John Green.;Paper Towns
4.5;Het meest vertaalde Franse boek wordt op weergaloze wijze verenigd met het verhaal van een eenzaam negenjarig meisje dat uit haar strakke keurslijf probeert te ontsnappen.;De Kleine Prins
3.5;Marvels nieuwste toevoeging aan de familie superhelden is een grote onbekende, die nogal klein van stuk is.;Ant-Man
4.0;Euthanasie gaat er nog niet echt in bij de Israëlis. Een groep grijsaards in een bejaardentehuis neemt het heft in eigen handen.;The Farewell Party
4.0;Een callgirl, een psychiater en een overspelige toneelgroep raken verwikkeld in een even vermakelijke als vergezochte klucht.;Shes Funny That Way
4.0;Mooi menselijk Mexicaans jongerendrama werd op de Berlinale uitgeroepen tot beste speelfilmdebuut.;Güeros
1.5;Frans drama over rouwverwerking doet nauwelijks eer aan de hereniging van sterren Isabelle Huppert en Gérard Depardieu.;Valley of Love
2.0;De derde in de reeks lofzangen op wereldsteden valt het meest tegen. Van zon, zee, strand en samba zou je toch wat meer passie verwachten.;Rio, I Love You
4.0;Schitterende en sterk geacteerde karakterschets van s werelds beroemdste detective.;Mr. Holmes
2.0;Een terminaal zieke Ben Kingsley ruilt met het lichaam van een vitale Ryan Reynolds. De ongeloofwaardigheid van dit gegeven is nog het minste probleem in de nieuwe Tarsem Singh.;Self/Less
1.0;Vijf redenen waarom horrormakers de 'found footage'-hype zo snel mogelijk de rug toe moeten keren.;The Gallows
3.0;Wim Wenders is terug van weggeweest met dit visueel bijzondere drama over de gevolgen van een noodlottig ongeluk.;Every Thing Will Be Fine
3.5;Verleden en heden lopen door elkaar in deze degelijke thriller van Nederlandse bodem.;De Reünie
3.5;Ode aan de softerotische films van de jaren zeventig waarin sm op geslaagde manier wordt voorzien van een artistiek tintje.;The Duke of Burgundy
3.0;Luchtige en amusante familiekomedie over het ophouden van de schijn. Met een glansrol voor Billy Connolly.;What We Did On Our Holiday
5.0;Pixars nieuwste is niets minder dan een meesterwerk.;Inside Out
1.5;Flauwe, inspiratieloze animatiefilm over twee diersoorten die dreigen uit te sterven omdat ze niet mee mogen op de Ark van Noach.;Beestenboot
2.0;Hollywood op zn slechtst.;Terminator: Genisys
4.0;Het surrealistische moerasgebied in Andalusië is één van de hoofdfiguren in deze prachtig geschoten, intelligente misdaadthriller rondom de verdwijning van twee zussen.;La Isla Mínima
4.0;In deze unieke, atypische romkom moet een bijzondere vakantie leiden tot een nieuwe vonk in een uitgebluste relatie.;The One I Love
2.5;Michael Winterbottoms fictieve interpretatie van de Amanda Knox-zaak is gemaakt met goede bedoelingen, maar wordt gehinderd door een wankele uitvoering.;The Face of an Angel
3.5;Een inkijkje in de werkwijze van het prestigieuze modehuis Christian Dior. Meeslepend, wervelend, maar ook redelijk safe omdat het geen enkele kritische noot plaatst.;Dior and I
3.0;Amusante jeugdfilm met heel matige schurken.;De Vijf en de Piratenschat
4.0;Mannelijke entertainers zorgen voor grote glimlach op het gezicht.;Magic Mike XXL
4.0;Malony is een echt rotjoch, maar een kinderrechter vertolkt door Catherine Deneuve probeert hem in het gareel te krijgen. Fel en overdonderend Frans jeugddrama.;La Tête Haute
1.5;Milla Jovovich heeft wel eens een betere klus gehad dan deze zwalkende thriller waarin ze een aanslag moet zien te voorkomen en haar naam moet zuiveren.;Survivor
3.0;Klein familiedrama waarin vier vrouwen het zelf moeten zien te rooien op het Italiaanse platteland.;In Grazia di Dio
3.5;Knappe debuutfilm van regisseuse Lucie Borleteau.;Fidelio
2.0;Morgan Freeman en Diane Keaton willen verhuizen, maar hun oude woning koestert vele herinneringen. Dit kabbelende feelgooddrama houdt zich op de vlakte.;Ruth & Alex
3.5;Vaderloos opgroeien is moeilijk, maar je vader pas na jaren weer terugzien nog moeilijker. Het overkomt Liza, die sinds haar derde haar vader heeft moeten missen.;Meet Me in Venice
2.5;Strijd en vriendschap tussen mensen en wolven in Chinese boekverfilming van de regisseur van Seven Years in Tibet.;The Last Wolf
2.0;Een ex-crimineel en zijn beste vriend jatten de kist met inhoud van de overleden Charlie Chaplin. De maker van het weergaloze Des Hommes et des Dieux kon er klaarblijkelijk wél om lachen.;La Rançon de la Gloire
4.0;De gele mannetjes in tuinbroekjes blijken zich zonder Gru ook prima te kunnen redden.;Minions
4.0;Uitdagende en meeslepende debuutfilm over de jonge Ayoub, die de grootste crimineel van Amsterdam-Noord moet worden om het hart van een meisje te veroveren.;Prins
3.0;Bejaarde popster Pacino gooit al zijn charmes in de strijd om deze soms wat voor de hand liggende feelgoodfilm van de middelmaat te redden.;Danny Collins
3.0;Derde deel van succesvolle horrorreeks is een degelijke maar weinig verrassende prequel.;Insidious: Chapter 3
3.5;Op visueel vlak is deze natuurdocumentaire verbluffend sterk.;Nature
1.5;Barre verfilming van het boek van Peter R. de Vries over de ontvoering van Freddy Heineken door Cor van Hout en zijn kornuiten.;Kidnapping Freddy Heineken
4.0;De moderne grenzeloze toerist wil oorspronkelijkheid en authenticiteit. De arme bevolking in Laos wil vooruitgang.;Banana Pancakes and the Children of Sticky Rice
3.0;Kamermeisje Léa Seydoux probeert aan haar afkomst te ontsnappen.;Journal dune Femme de Chambre
2.5;De elfjarige Isabel en haar vrienden zoeken naar het zwaard van de legendarisch musketier dArtagnan. De vorige twee projecten van Dennis Bots kwamen beter uit de verf.;Code M
4.0;Een onconventioneel gezin en een huishouden van Jan Steen met een manisch depressieve vader. Mark Ruffalos spel is weergaloos.;Infinitely Polar Bear
3.5;Ingetogen kostuumdrama met Kate Winslet en Matthias Schoenaerts in de exorbitante tuinen van Versailles.;The Kings Gardens
5.0;De donkere wereld van Ridley Scotts scifi-klassieker imponeert nog steeds.;Blade Runner, The Final Cut
2.0;Deze gezapige romance bewijst met verve dat onsterfelijkheid kan gaan vervelen,;The Age of Adaline
3.0;Een elfjarige Tsjetsjeense vluchteling is de man des huizes maar ook nog kind. De komst van een vriend van zijn overleden vader gooit zijn leven overhoop.;Macondo
2.0;Ode van Greenaway aan Eisenstein is misschien kleurrijk, maar kent weinig inhoud.;Eisenstein in Guanajuato
4.5;Het niveau van de eerste Jurassic Park valt onmogelijk te overtreffen maar dit derde vervolg komt een heel eind.;Jurassic World
2.5;Boys will be boys.;Entourage
3.5;Jong meisje ontdekt een mysterieus verleden in een Iers dorpje.;The Legend of Longwood
3.5;De Iraanse filmmaker Jafar Panahi filmde in het geheim de kleurrijke inwoners van Teheran.;Taxi Teheran
3.5;Tragisch Brits oorlogsdrama over een inspirerende pacifiste blijft iets te veel hangen in misère.;Testament of Youth
4.0;De komische timing van Melissa McCarthy gecombineerd met de wervelende actiescènes van Paul Feig bewijzen dat er best plek is voor nog een Bond-parodie.;Spy
3.5;Boeiend menselijk drama tegen de achtergrond van de zombieapocalyps.;El Desierto
2.0;Zwalkende thrillerverfilming van een spannend boek van Esther Verhoef. De vrouwelijke hoofdpersoon toont weinig ballen.;Rendez-vous
3.5;Een enerverend dagje en nachtje doorhalen met Simon Pegg en Lake Bell die de date van hun leven beleven, maar onder valse voorwendselen.;Man Up
4.0;Intrigerende documentaire over een Zuid-Afrikaanse vissersgemeenschap in gevaar: hun enige kans op rijkdom is de vangst van een bedreigde diersoort.;Between the Devil and the Deep
3.5;Israëlisch drama over een jonge Palestijn op zoek naar een eigen identiteit.;Dancing Arabs
3.0;Als pesten tegenwoordig digitaal gaat, kun je er natuurlijk op rekenen dat de vergelding dat ook doet.;Unfriended
2.5;Rampenfilm die doet wat ie moet doen.;San Andreas
4.5;Een confronterend drama rondom de problematische situatie van de Aboriginals in Australië.;Charlies Country
3.5;De nieuwe van Alex van Warmerdam daagt je uit: ben je voor Schneider of voor Bax?;Schneider vs. Bax
2.5;De moderne manier van oorlogvoeren gebeurt vanuit de luie stoel in een container in Nevada. Majoor Tom Egan mist de spanning. Het publiek van Good Kill waarschijnlijk ook.;Good Kill
2.0;Waargebeurd verhaal over een Tweede Wereldoorlog-slachtoffer dat een geroofd kunstwerk terug wil hebben. En dat is niet zomaar een kunstwerk.;Woman in Gold
4.5;Adembenemende docuthriller over klokkenluider Snowden en de afluisterpraktijken van de NSA.;Citizenfour
4.0;De tweede speelfilm van Mike van Diem is minder degelijk dan Karakter, maar eveneens een fijn stukje Nederlandse cinema. En dat voor een literaire romkom!;De Surprise
4.0;Een optimistische blockbuster zoals je die zelden tegenkomt.;Project T
4.0;Een zwart-wit vampierwestern uit onverwachte hoek. En wat voor één.;A Girl Walks Home Alone at Night
2.5;Romeo en Julia in hedendaags Zuid-Frankrijk, verteld vanuit het perspectief van Broeder Laurens.;Geronimo
3.0;Ze zijn (weer) hier;Poltergeist
3.0;Hartverscheurend verhaal over een veertienjarig meisje dat door haar aanstaande man wordt ontvoerd en hem tijdens een ontsnappingspoging doodt. Ethiopische Oscarinzending.;Difret
2.0;Komedie over vier dertigers die hun droom om bekende rappers te worden, achterna gaan.;De Masters
4.5;Spectaculaire actiefilm die eigenlijk één lange, spannende achtervolging is.;Mad Max: Fury Road
3.0;Vier mannen beklimmen op hun racefiets de Mont Ventoux. Tijdens deze tocht blijkt dat de berg niet de enige hobbel is die ze moeten overwinnen.;Ventoux
4.0;Intiem portret van een gezin, waarvan de moeder bezig is met een geslachtsverandering en de dochter zichzelf ontdekt. Gefilmd op tweeënvijftig dinsdagen.;52 Tuesdays
3.5;Op een paar valse noten na is Pitch Perfect 2 een geslaagd vervolg op de hit uit 2012.;Pitch Perfect 2
5.0;Een niet te missen, welhaast verplichte klassieker die gerestaureerd opnieuw in de bioscoop draait.;Tokyo Story
2.5;Zwabberend Belgisch drama rondom een draagmoederschap waarbij de twee betrokken partijen steeds meer naar elkaar toetrekken.;Melody
3.5;President Samuel L. Jackson stort zich in een wildernisavontuur.;Big Game
2.0;Dit eerste deel van de verfilming van de trilogie van Tom Smith over kindermoorden in het Sovjettijdperk smaakt nu niet bepaald naar meer.;Child 44
3.5;Thomas Vinterberg waagt zich aan een bewerking van de klassieke roman van Thomas Hardy.;Far From the Madding Crowd
4.0;Bijzondere biopic over snelschaker Genesis Potini die ondanks zijn manische depressie ontspoorde jongeren op het rechte pad weet te houden.;The Dark Horse
2.0;Will Ferrell heeft de hulp nodig van Kevin Hart om te kunnen overleven in de gevangenis.;Get Hard
3.0;Een gruwelijk en confronterend verhaal over een jonge albino die zich nergens veilig waant in Tanzania.;White Shadow
2.5;Het tweede deel van een trilogie over gezinsrelaties, verlies en eenzaamheid verdwaalt in lijzig tempo.;Im the Same, Im an Other
3.0;Creatieve, vrij volledige kijk op de vluchtelingenproblematiek van de Middellandse Zee.;Those Who Feel the Fire Burning
3.5;Geslaagd regiedebuut van Alex Garland over kunstmatige intelligentie.;Ex_Machina
3.5;Ryan Goslings regiedebuut heeft de Nederlandse bioscopen gelukkig toch gehaald. Al is het maar voor even.;Lost River
4.0;Coming-of-agedrama met sterk acteerwerk dat de zaken net even anders bekijkt.;Les Combattants
2.0;Voor een film met de spectaculaire sport Parkour als middelpunt bevat Tracers genoeg vaart en actie, maar ook niet meer dan dat.;Tracers
3.0;Ruim vijftien jaar na het aflopen van de Tweede Wereldoorlog zijn veel oorlogsmisdadigers nog niet vervolgd. Een bevlogen jurist besluit tot een klopjacht.;Im Labyrinth des Schweigens
3.5;Speelfilmdebuut van documentairemaakster Marjoleine Boonstra over de bewoners van een droog zoutlandschap in Kirgizië.;Kurai Kurai  Tales on the Wind
2.5;Deze Heleen van Royen-verfilming is slechts een korte ontsnapping uit de werkelijkheid. De tweede helft heeft beduidend meer kwaliteit en inhoud dan de lege eerste.;De Ontsnapping
4.0;Een heerlijke mix van familiefilm en misdaadkomedie, gemaakt met een vette knipoog.;De Boskampis
1.5;Het Duitse kinderfenomeen Bibi Blocksberg wil in onze Lage Landen maar moeilijk aanslaan. Alle toverkracht van het meiske ten spijt.;Bibi & Tina
3.5;Met het hoge, gevarieerde tempo is dit grootse popcornspektakel één brok entertainment.;Avengers: Age of Ultron
4.5;David Robert Mitchell zet met een steengoede griezelfilm de Amerikaanse horror weer op de kaart.;It Follows
4.0;De wellicht laatste avondvullende animatiefilm van Studio Ghibli is een prachtige verkenning van droom, werkelijkheid, vriendschap en verlangen.;When Marnie Was There
4.0;Deze biopic is geen feest van herkenning, en dat maakt hem juist zo interessant.;Jimi: All is by My Side
4.0;Een beklemmende mix tussen drama en thriller, waarin een overbeschermende moeder de gezondheid van haar kind gevaar brengt.;Hungry Hearts
4.0;Het nationale voetbalteam van Amerikaans-Samoa staat te boek als het slechtste ter wereld. Een Nederlandse coach moet zorgen voor de eerste overwinning.;Next Goal Wins
3.0;Spirituele overlevingstocht van een dolende Marokkaanse windsurfer.;Atlantic.
3.0;Spaanse stopmotionanimatie met een volwassen en griezelige inslag.;O Apóstolo
3.5;Mooi gefilmde, helder vertelde documentaire over het eerste levensjaar van twee jonge grizzlybeertjes.;Bears
3.0;Na Matterhorn hadden we misschien iets anders of beters verwacht van Diederik Ebbinge, maar dit kinderavontuur heeft ergens wel zijn charme.;Kidnep
2.5;Russell Crowe maakt zijn regiedebuut met een vrij oubollig drama over de nadagen van de Eerste Wereldoorlog.;The Water Diviner
3.0;Doorsneethriller met Liam Neeson vermaakt zolang hij duurt.;Run All Night
4.5;De gedreven Paula, onbegrepen door dove ouders, ontdekt haar zangtalent. Tussen de zanglessen door vindt zij echter pas werkelijk haar eigen stem.;La Famille Bélier
4.0;Meeslepend en ontroerend Brits-Cambodjaans drama over twee verloren zielen die rouwen om het verlies van een dierbare zonder dat ze elkaar kunnen verstaan.;Lilting
2.0;Flauwe en inspiratiearme animatiefilm over een eekhoorn die zijn eer wil redden en oog in oog met een groep menselijke bankrovers komt te staan.;De Notenkraak
4.0;Heerlijk absurde tragikomedie die zowel de alternatieve muziekscene als de moderne communicatiemiddelen op de hak neemt.;Frank
