4.0;Bewerking van het klassieke jeugdboek van Maurice Sendak is een prachtige jeugdfilm die op unieke wijze laat zien hoe het is om een kind te zijn.;Where the Wild Things Are
3.0;Slaapstoornissen onder de bevolking van het verre Alaska.;The Fourth Kind
4.0;Twee heteroseksuele mannen maken samen een pornofilm. Een bromancekomedie was zelden zo bromantisch.;Humpday
3.0;Heruitgave van een klassieker uit 1954 is vooral de moeite waard vanwege Humphrey Bogart en Ava Gardner.;The Barefoot Contessa
3.0;Een uitgerangeerde Russische dirigent krijgt de kans zich te wreken op de autoriteiten door met zijn orkest van weleer het geliefde vioolconcert van Tsjaikovski naar Parijs te brengen.;Le Concert
2.0;Een richtingloze film die slechts sporadisch een beetje leuk is en de indruk wekt dat niemand echt de moeite wilde nemen om kwaliteit te leveren.;The Men Who Stare at Goats
4.0;Snatch-regisseur Guy Ritchie weet de personages uit Sir Arthur Conan Doyles verhalen naar zijn hand te zetten. Het Victoriaanse Londen oogt authentiek, maar voelt eigentijds aan.;Sherlock Holmes
3.5;De meest persoonlijke documentaire van John Appel over oplichten, gokken en af en toe een kansje wagen.;The Player
3.5;Een intrigerend portret van de man achter de evolutietheorie, maar het is een beetje teleurstellend dat er nauwelijks op die theorie wordt ingegaan.;Creation
3.0;Deel zes in deze langlopende horrorfranchise doet wat van het verwacht wordt en levert anderhalf uur malle plots en smerigheid.;Saw VI
3.0;Hoe ouder je bent, hoe ingewikkelder de liefde. Its Complicated is daarentegen ongecompliceerd en voorspelbaar. Een standaard romkom, maar wel een leuke.;It's Complicated
3.5;Debuut van Palestijns-Amerikaanse Cherien Dabis is een heel aardige film over aanpassingsproblematiek van migranten in de Verenigde Staten.;Amerrika
1.5;Twee mannen moeten op twee lastige koters passen met alle gênante gevolgen van dien. Met dit uitgangspunt kan het toch niet anders dan dat Old Dogs de beste komedie van dit jaar is.;Old Dogs
4.5;De langverwachte nieuwe film van Jean-Pierre Jeunet is niet zo meesterlijk als Amélie, maar wel een visueel feest en op de valreep een van de leukste films van dit jaar.;Micmacs à Tire-Larigot
3.0;Deze winnaar van de Gouden Beer in Berlijn heeft een bijzonder vreemd uitgangspunt, maar ontpopt zich tot een degelijk, weinig spectaculair portret van een Peruaanse vrouw.;The Milk of Sorrow
2.0;Matige verfilming van de helse Elfstedentocht van 1963 komt gedateerd en knullig over, ondanks de goede bedoelingen van de makers.;De Hel van '63
4.5;Avatar: een nieuw begrip in de filmgeschiedenis?;Avatar
4.0;Amerikaanse remake van de film van Susanne Bier blijft onverminderd actueel en schetst een uitstekend beeld van wat oorlog met mensen kan doen.;Brothers
3.0;Winnaar van het Gouden Kalf voor beste film is een minimalistisch portret van een Nederlandse vrouw die vlucht naar het Ierse platteland om haar beëindigde relatie te verwerken.;Nothing Personal
3.5;Een visuele tour de force omlijst een klein drama over de mislukte levens van twee vrouwen in een (ogenschijnlijk) kleurloos voorstadje van Boedapest.;Fresh Air
2.0;Opmerkelijk sadistische thriller wil iets zeggen over de morele dilemmas van het rechtssysteem, maar schiet daarin ernstig tekort.;Law Abiding Citizen
4.0;De nieuwste Jim Jarmusch zou best wel eens een lege stijloefening kunnen zijn, maar net zo goed een betekenisvolle film. De stijl zelf is hoe dan ook prachtig.;The Limits of Control
4.5;Zeer intense en ongemakkelijke film geeft een stem aan de zwarte Amerikaanse onderklasse, een groep waar we veel over horen en lezen, maar veel te weinig van zien.;Precious
1.5;Ninja Assassin ziet er soms uit als een film voor achttien jaar en ouder, maar blijft aanvoelen als een sof voor alle leeftijden.;Ninja Assassin
2.5;De winnaar van de publieksprijs op het IDFA 2009 toont ons gruwelijke beelden van dolfijnenjacht in een matige, maar noodzakelijke documentaire.;The Cove
4.0;Michael Moore valt het kapitalisme aan in zijn nieuwste documentaire, die een stuk geslaagder is dan zijn vorige twee films.;Capitalism: A Love Story
4.5;Liefde en vreemdgaan in tijden van kanker. Een prachtige doch veilige boekverfilming. Vergeet Turks Fruit, hier is Komt Een Vrouw bij de Dokter.;Komt Een Vrouw bij de Dokter
3.5;Oren Peli bewijst dat je ook met $11.000 een heerlijke filmervaring kan creëren, die veel Hollywoodhorrors overtreft. Saw VI eat your heart out!;Paranormal Activity
3.5;Reconstructie van het beleg van Nanking, vlak voor de Tweede Wereldoorlog, moet het vooral hebben van zijn voorbeeldige hoofdrolspeler Ulrich Tukur.;John Rabe
4.0;Derde film van de new great American director is een fijne en bijzondere vertelling over een onwaarschijnlijke vriendschap.;Goodbye Solo
3.0;Het vuur laait op tussen twee exen, maar de gevolgen zijn niet zo interessant als de maker zou willen.;Les Regrets
4.5;Michael Hanekes nieuwste, over een mysterieuze Duitse dorpgemeenschap, is weer een uiterst fascinerende film. Dit keer subtiel, minder gewelddadig en nauwelijks shockerend.;Das Weiße Band
3.0;Visueel is A Christmas Carol spectaculair, maar de humanistische themas van het onvergetelijke verhaal komen er wel erg karig van af.;A Christmas Carol
3.5;Drank, sneeuw en depressie lijken dé ingrediënten voor een dieptreurig Scandinavisch drama. Dat er een montere, soms zelfs hilarische film van te brouwen is, bewijst dit regiedebuut.;North
3.0;Vervolg op het immens succesvolle Twilight heeft nog steeds last van het belabberde bronmateriaal, maar is qua film beter geslaagd dan het eerste deel.;The Twilight Saga: New Moon
1.5;Enkele aardige grappen zijn niet genoeg om deze flauwe en te lange komedie leuk te maken.;Couples Retreat
4.0;Larry David en Evan Rachel Wood spatten van het scherm in Woody Allens nieuwste film Whatever Works. Cynisme was nog nooit zo leuk.;Whatever Works
2.0;Belachelijke film over tijdreizen neemt zichzelf veel te serieus. Het zou lachwekkend zijn als het allemaal niet zo deprimerend werd gebracht.;The Time Traveler's Wife
4.0;Scherpe, hilarische theatervoorstelling van Theo Maassen die nu ook in de bios is te zien.;Zonder Pardon
3.0;Alles mag kapot in 2012, de nieuwste rampenfilm van Roland Emmerich die alle andere rampenfilms overbodig moet maken.;2012
2.0;Halfslachtige poging tot een drama over rouwverwerking laat een zwakke indruk achter doordat de genreconventies van de romantische komedie niet opzij worden geschoven.;Love Happens
3.5;Deense Oscarinzending van dit jaar is een heel aardige kruising tussen een spaghettiwestern, een Coen-film en talloze andere filmgenres.;Terribly Happy
3.5;Keurige horrorthriller over een geadopteerde wees die niet zo onschuldig is als ze lijkt. Isabelle Fuhrman geeft op schitterende wijze gestalte aan het enfant du diable.;Orphan
3.5;Egels en zingeving. Van levensbelang in de wereld van een elfjarige.;Le Hérisson
2.0;Alweer een vampierfilm gericht op tieners. Het oogt leuk en kleurrijk, maar inhoudelijk blijft de film zwart-wit.;Cirque du Freak: The Vampire's Assistant
3.5;Paniek In Het Dorp is een excentrieke kleianimatiefilm die door de flauwe, absurde humor voor volwassenen minstens zo leuk is als voor de kleintjes.;Paniek in het Dorp
4.5;Fenomenale acteerprestaties van Willem Dafoe en Charlotte Gainsbourg in deze harde, weerzinwekkende, maar o zo prachtige filmische depressie-uiting. Von Trier op zn best!;Antichrist
2.5;Tien verbonden verhalen die samen een liefdesbrief aan New York vormen. Het is de vraag of de stad voor de avances van de regisseurs valt, want erg overtuigend wil hun ode niet worden.;New York, I Love You
4.0;Moeten we huilen of lachen? Een serieus onderwerp was zelden zo grappig. Soderberghs nieuwste zit boordevol hilariteit, absurditeit en onverwachte plotwendingen.;The Informant!
2.0;Er is weinig reden om op 29 oktober naar de langverwachte verfilming van Saskia Noorts boek te gaan. Zelfs met een sterrencast weet Koopman niks bijzonders neer te zetten.;Terug Naar de Kust
3.0;Poëtische film over eenzaamheid in het grauwe en arme Estland. De film is zo deprimerend dat de zwarte humor verloren gaat in de ellende.;Autumn Ball
3.0;Documentaire over de voorbereidingen van de afscheidstour van Michael Jackson smaakt vooral naar meer.;This Is It
5.0;Andrea Arnold vestigt zich met Fish Tank, haar tweede film na het al even briljante Red Road, definitief tussen de belangrijkste filmmakers van dit moment.;Fish Tank
2.5;Rob Zombies tweede film over psychopaat Michael Myers is zonder twijfel de bruutste uit de Halloweenreeks, maar is gebaat bij een betere spanningsopbouw.;Halloween II
3.5;Franse film met Kristin Scott Thomas begint als een moderne variant op Madame Bovary en Lady Chatterley, maar slaat vervolgens veel interessantere wegen in.;Partir
4.5;Magnifiek kostuumdrama van Jane Campion over de relatie tussen John Keats en Fanny Brawne is een lust voor het oog en het hart.;Bright Star
4.5;Niets is zo simpel als het lijkt in deze zeer onderhoudende en subtiele scififilm.;Moon
2.5;Er is slechts één reden om Julie & Julia te gaan bekijken en die reden luistert naar de naam Meryl Streep;Julie & Julia
2.5;Surrogates is een prima filmsnack, maar zeker geen hoofdmaaltijd. Daarvoor is het verhaal te suf en de achterliggende filosofie te uitgekauwd.;Surrogates
2.0;Matige opvolger van This is England is meer een uit de hand gelopen korte film dan een volwaardige speelfilm.;Somers Town
2.0;Highschoolfilm met een horrorrandje en een aardig, maar matig uitgevoerd idee in de vorm van Megan Fox die mannen verslindt.;Jennifer's Body
3.0;Nieuwste Eddie Murphy-vehikel is een degelijke en ietwat veilige familiefilm, waar niemand aanstoot aan zal nemen.;Imagine That
4.0;Fantastisch regiedebuut van Neill Blomkamp versmelt overbekende sciencefictionelementen in een smakelijke en energieke film die van het witte doek af knalt.;District 9
2.0;Twee mensen raken hun kind kwijt bij de aanslagen van 2005 in Londen. Wat een spannende confrontatie had kunnen zijn, blijft steken in goede bedoelingen.;London River
4.0;Speelfilmdebuut van regisseur Danyael Sugawara is een prachtig humanistisch portret over een gecompliceerde relatie tussen een moeder en haar zoon.;Alles Stroomt
2.0;De veelbewegende camera simuleert een spektakel, maar door het gebrek aan een interessante cast blijft Fame een lege huls.;Fame
3.5;Een kijkje op Winnipeg...en op de neuroses van Guy Maddin.;My Winnipeg
3.5;De Belgische Oscarinzending weet te overtuigen, maar een Oscar voor Beste Niet-Engelstalige Film kunnen onze zuiderburen vergeten.;De Helaasheid der Dingen
2.5;Neveldine en Taylor houden zich met dit adrenaline verhogende spel te veel in, waardoor het niet veel meer wordt dan een halfgeslaagd broertje van de [i]Crank[/i]-films.;Gamer
4.5;Pixars tiende is weer een feest van op hoog niveau uitgevoerde creativiteit.;Up
3.0;Een hier en daar wat rommelige afsluiting van een unieke, gedurfde trilogie rondom een grote familie en een aantal andere deelgenoten.;Happy End
2.5;The Ugly Truth gaat over mannen en vrouwen en de manier waarop zij elkaar het hof maken. Deze romantische komedie is er een van vele, maar pretendeert ook niet meer te zijn dan dat.;The Ugly Truth
0.0;Dit is niet meer het laagdrempelige pamflet met simplistische synthesizermuziek dat je kent als Wit Licht.;The Silent Army
4.0;Geen liefdesverhaal of romantische komedie, maar een heerlijke onconventionele tragikomedie over liefde.;(500) Days of Summer
3.5;Een clash tussen stad en platteland plus een rouwende overvaller en zijn opgekropte wraakgevoelens leveren een eigenzinnig psychologisch drama op.;Revanche
3.0;Deze veelbelovende romkom wordt neergehaald door oppervlakkige personages en gebrek aan originaliteit.;The Rebound
1.0;Walgelijke mix van seksistische grappen, racistische grappen en heel veel leedvermaak. De Wayans Brothers bewijzen definitief door hun inspiratie heen te zijn.;Dance Flick
4.0;Goede acteerprestaties en een flinke dosis spanning in de nieuwste Carry Sleeverfilming. Een must-see voor de fans, een goede keuze voor veel anderen.;Lover of Loser
4.0;Grote Nederlandse film over de watersnoodramp van 1953 maakt indruk door zich te richten op het persoonlijke leed van de slachtoffers.;De Storm
3.5;Enerverende optredens van o.a. James Brown & B.B. King, maar tussen de (te korte) optredens door heerst de willekeur in deze documentaire.;Soul Power
4.0;Tussendoortje van Ang Lee is een vermakelijk portret van een jongen die volwassen wordt tijdens Woodstock.;Taking Woodstock
3.0;Deze documentaire doet zijn best het clichébeeld van Anna Wintour als gigabitch te bevestigen, maar biedt vooral een luchtig kijkje achter de schermen van modemagazine Vogue.;The September Issue
4.0;Zeer geslaagde feelgoodfilm van Ken Loach die op ieders gezicht een glimlach zal toveren.;Looking for Eric
5.0;Misschien wel de beste thriller van het jaar.;The Chaser
2.5;Onevenwichtige film over de nasleep van een vliegramp moet het hebben van een verrassend slot en een goede rolbezetting.;Passengers
2.5;Sfeerimpressie van het Los Angeles van de jaren tachtig waar te veel nooit genoeg is.;The Informers
3.5;Slimme en verzorgde tragikomedie over de roadtrip van een alleenstaande moeder en haar puberzoons is een waar feest van jarenvijftigherkenning.;My One and Only
1.5;Een zeer matige dertien-in-een-dozijnthriller met een zwak script en oninteressante personages. Alleen de muziek en de acteurs zijn deugdelijk.;Tenderness
4.0;Aangrijpende en indrukwekkende film over jonge ex-gevangene die een nieuwe start maakt.;Troubled Water
2.0;Eén auto, één actrice, één laatste telefoongesprek, vijfentwintig cameras en één take: een experiment en helaas weinig meer.;Last Conversation
3.5;9 wordt door een oude professor op een verwoeste aarde gezet. Met hulp van Tim Burton en Timur Bekmambetov maakte Shane Acker een wat simplistisch, maar prachtig animatie-epos.;9
4.5;Visueel juweeltje van eigen bodem roept vragen op over hel en hemel, maar vooral over het menselijk talent om alles wat mooi is stuk te maken.;Het Leven Uit Een Dag
3.5;Derde film van Judd Apatow is een ambitieuze en grotendeels geslaagde mix van komedie en drama met een uitstekende Adam Sandler.;Funny People
2.0;Langdradige semibiografie over de zeventienjarige Siciliaanse Rita Atria die de maffia aanklaagt en daarmee haar eigen leven in gevaar brengt.;La Siciliana Ribelle
3.5;Aan de hand van werkelijke en gefictionaliseerde interviews van fabrieksarbeiders wordt een halve eeuw Chinese geschiedenis geschetst.;24 City
4.5;Met deze hilarisch vulgaire oorlogsfantasie laat Quentin Tarantino weer een fraai staaltje van zijn kunnen zien.;Inglourious Basterds
3.5;Na het meesterlijke Volver bezwijkt de nieuwste film van Pedro Almodóvar onder zijn eigen ambitie, maar weet op het visuele vlak wel te imponeren.;Los Abrazos Rotos
4.0;Bandslam is een verrassing van jewelste. Geen Amerikaanse formulefilm, maar een oprechte en lieve tienerkomedie.;Bandslam
2.0;Uitermate donkere film die vanaf de openingsscène fascineert maar uiteindelijk vooral weet te irriteren.;The Stranger
3.0;Een gedreven Jim Sturgess blijft overeind in een conventionele verfilming van Martin McGartlands autobiografische verhaal ten tijde van het Iers-Britse conflict in de jaren tachtig.;Fifty Dead Men Walking
4.0;Heerlijke Italiaanse film is een hartverwarmende ode aan de ouderdom.;Pranzo di Ferragosto
2.5;Als film inadequaat en oninteressant, maar als bevreemdend (pop)cultureel fenomeen van onze tijd toch nog boeiend.;Hannah Montana: The Movie
3.0;Een kat-en-muisspel zonder pretenties, maar met een hoge concentratie mooie actie en fantastische cinematografie zoals we van Tony Scott gewend zijn.;Taking of Pelham 1-2-3
2.0;Missie op de automatische piloot met personages die net zo plastic zijn als de poppetjes van Hasbro.;G.I. Joe: Rise of Cobra
3.5;In een aangenaam tussendoortje schetst Sam Mendes voor de verandering eens een positief beeld van het Amerikaanse gezin.;Away We Go
2.0;Mozaïekvertelling over immigratie in Amerika vliegt alle kanten op en blijft uiteindelijk aan de oppervlakte steken.;Crossing Over
3.5;Hoewel er genoeg valt te genieten aan Unmade Beds, voelt de film een beetje aan als een Ikeakast.;Unmade Beds
4.0;Uitstekende Zweedse thriller die de toon van het succesvolle boek van Stieg Larsson perfect op het witte doek weet over te brengen.;Millennium: Mannen Die Vrouwen Haten
4.0;Droevig, minimalistisch drama over de gemarginaliseerden van de Amerikaanse samenleving, met een sterke genuanceerde acteerprestatie van Michelle Williams.;Wendy and Lucy
4.0;Michael Manns nieuwste onderscheidt zich door een hoog authenticiteitsgehalte en een stralende Marion Cotillard.;Public Enemies
3.5;Een prachtige film over de opbouwende kracht van liefde, maar ook een hele trieste film over de verwoestende eigenschap van diezelfde liefde.;Welcome
3.5;Een aardige potpourri over lesbische vampiers, die weliswaar niet hilarisch is, maar waar je wél met een gerust hart je tanden in kan zetten.;Lesbian Vampire Killers
2.0;CGI-cavia's redden de wereld maar niet de film.;G-Force
3.5;De geheimen van een kreukloze huisvrouw in een frisse tragikomedie vol jarennegentigsterren.;The Private Lives of Pippa Lee
2.0;Een romcom waar maar weinig om te lachen of te zwijmelen valt en die zelfs een nogal preutse boodschap uitstraalt.;Ghosts of Girlfriends Past
3.5;Traditionele, maar effectieve gevangenisthriller met een twist.;The Escapist
4.0;Deze prachtige kinderfilm brengt jonge kijkers naast vermaak zelfs wat ecobewustzijn bij.;Ponyo
3.0;Deze nieuwe verfilming van de bekende stripboekenreeks is nog steeds niet wat het zou kunnen zijn, maar zet wel een stap in de goede richting.;Suske en Wiske & De Texas Rakkers
3.5;Deze Taiwanese roadmovie is voor een klein deel geforceerd, vervreemdend en saai, maar voor een groot deel interessant en wonderschoon.;The Most Distant Course
3.0;Aardige zomerfilm van Carlos Cuaron (het broertje van Alfonso) over twee broers die furore maken in de Mexicaanse voetbalcompetitie.;Rudo Y Cursi
3.5;Zingende non intrigeert in mooie film die veel van de kijker vergt, maar allesbehalve teleurstelt.;Soeur Sourire
2.0;Vader en dochter in Parijse buitenwijk nemen geleidelijk afscheid van elkaar in een film vol stroperige stiltes.;35 Rhums
3.0;Een aspecifiek detectiveverhaal in een betoverende setting.;In the Electric Mist
4.0;De nieuwste Harry Potter, een van de betere, is met zijn duistere sfeer en spanning geen kinderfilm meer.;Harry Potter and the Half-Blood Prince
3.5;Een venijnige komedie van de maker van Borat, waarin de kijker wederom met vooroordelen wordt geconfronteerd.;Brüno
2.5;Regisseur Ogigami plaatst de gehaaste, moderne Taeko op een utopisch,  zonovergoten eiland van Japan in een film vol herhalingen.;Megane
2.0;Deze romcom wil graag lekker gek zijn, maar kleurt daarvoor net te veel binnen de lijntjes.;Management
2.0;Winterbottom speelt op een rare manier met herhaaldelijke spanningsopbouw die nergens heengaat in deze rouwfilm.;Genova
4.0;Sam Raimi kan nog steeds grappige horror maken. Bijna even leuk als de Evil Dead-films.;Drag Me to Hell
3.5;Een boeiend historisch drama dat in de eerste plaats om de hoofdpersoon draait, een sterke vrouw in het Zweden van begin vorige eeuw.;Everlasting Moments
4.0;Na het povere deel twee keert het illustere trio Sid, Manny en Diego in volle glorie terug. Al is het eigenlijk vooral een een-tweetje tussen Sid en Scrat.;Ice Age 3
4.0;Gelaagde film over de consequenties van een mediawerkelijkheid. Hoe bepaal je nog de waarheid?;Adoration
2.0;Matig kostuumdrama, gebaseerd op de Duitse klassieker van Theodor Fontane, maakt alleen indruk door hoofdrolspeelster Julia Jentsch.;Effi Briest
3.5;In de nadagen van de belle époque vallen courtisane Lea en de jonge Chéri elkaar in de armen. Met een laatste diepe ademteug nemen ze afscheid van een onbezonnen tijdperk en hun jeugd.;Chéri
3.5;Als art-thriller nogal doorsnee, maar het karakterspel blijft oneindig intrigerend met übersterren als Alain Delon en Romy Schneider.;La Piscine
1.5;Michael Bay overschreeuwt zichzelf in een veel te lange film die nooit grappig is en voor een groot deel zelfs uitermate saai.;Transformers: Revenge of the Fallen
4.0;Deze film is als een venster voor de ziel.;La Ventana
3.5;Politieke thriller blijft spannend tot nét voor het einde;State of Play
2.5;Een leugen van een jonge vrouw leidt tot een ware mediahype en zet Frankrijk eventjes op zijn kop.;La Fille du RER
2.0;Zwaarmoedige film over de nasleep van de Balkanoorlog. Snow won meerdere Europese prijzen, maar blijft een slechtlopende, sentimentele en te symbolisch beladen film.;Snow
4.0;Een hilarische uitschieter in het Amerikaanse vrijgezellenfeestgenre.;The Hangover
3.5;Deze remake van de nihilistische culthorror van Wes Craven is vooral qua spanning een enorme verbetering.;The Last House on the Left
3.5;Herzog reist af naar Antarctica...waar hij nog lang niet de vreemdste is.;Encounters at the End of the World
2.5;Door een overvloed aan maatschappelijke problemen raken de hoofdpersonen ondergesneeuwd en komen niet tot leven. Engagement en ambitie zijn niet genoeg voor een goede film.;Last Stop 174
4.0;Gedeeld verlies en het onvermogen erover te communiceren leiden tot meer verdriet, eenzaamheid en het uiteenvallen van een liefdevol paar.;Unspoken
3.5;In deze prettig lichtvoetige tragikomedie blijkt Jessica Biel over een behoorlijk talent te beschikken.;Easy Virtue
3.5;Bij lange na niet zo goed als de eerste twee Terminator-films, maar op zichzelf is de nieuwste Terminator ondanks enkele gebreken best een goede actiefilm.;Terminator Salvation
3.0;Rian Johnnson wilde een oplichtersfilm in de geest van The Sting, maar raakt verstrikt in zijn eigen plottwisten en logica.;The Brothers Bloom
3.5;Tony Gilroy laat met deze romantische spionagethriller wederom zijn kunde van het schrijven van een goed script zien en toont flair voor regie. Toch mist de film iets substantieels.;Duplicity
3.5;Japanse winnaar van de Oscar voor de beste buitenlandstalige film heeft als hoofdthema een weinig besproken, maar respectvol ritueel: het afleggen van overledenen.;Departures
3.5;Een alleraardigste komedie die wat meer grappen had kunnen gebruiken, maar overeind blijft dankzij de chemie tussen Segel en Rudd.;I Love You, Man
2.0;Some dreams are worth the fight. Net als de ondertitel is eigenlijk de hele film een groot cliché.;Fighting
3.5;Emily Blunt speelt een even rebelse als romantische jonge Queen Vic. Een solide kostuumfilm voor de liefhebber.;The Young Victoria
2.5;Casanegra toont een stijlvol clichébeeld van de minderbedeelden in het hedendaagse Casablanca.;Casanegra
4.0;Voetbal en religie zijn de enige toevluchtsoorden voor vier jongemannen in deze nietsontziende, authentieke film over het leven in Sao Paulo.;Linha de Passe
4.0;Meesterlijke auteursfilm van debuterend regisseur Guillermo Arriaga waarin schijnbaar losse levens door één onherroepelijke dramatische actie met elkaar zijn verbonden.;The Burning Plain
4.0;IJzingwekkende en bloederige horrorfilm met een intelligente onderlaag, waarin kinderen op volwassen stedelingen jagen.;Eden Lake
3.5;Regisseur Alan Ball bewerkte de roman Towelhead van Alicia Erian tot een waardige en grimmige opvolger van zijn onovertroffen American Beauty-scenario uit 1999.;Towelhead
3.0;Roemeense tragikomedie schakelt tussen kluchtige sprookjessfeer en grimmige Oostblokonderdrukking.;Silent Wedding
3.5;Een genietbare tragikomedie, meer dramatisch dan komisch, over twee zussen die plaatsen delict gaan schoonmaken.;Sunshine Cleaning
3.5;Groots en meeslepend spektakelstuk van Ron Howard is een enerverende kijkervaring, maar zal niet lang op het netvlies blijven hangen.;Angels & Demons - Het Bernini Mysterie
3.5;De prachtige vormgeving en verfrissende moraal doen veel, maar helaas niet alles, om de gammele plot te compenseren.;Coraline
4.0;Een prettige, haast ouderwetse western die het niet van actie maar van ijzersterke personages en acteerwerk van met name Ed Harris en Viggo Mortensen moet hebben.;Appaloosa
4.0;De oorsprong van de crew van de Enterprise. Topvermaak voor zowel fans als degenen die niet bekend zijn met Star Trek.;Star Trek
3.5;Emma Blank is stervende en dat weten haar bedienden maar al te goed. Maar niets is wat het lijkt te zijn in deze lichtvoetige komedie met een grimmig tintje.;De Laatste Dagen van Emma Blank
3.0;Sergei Dvortsevoy toont ons het leven op een Kazachse steppe waar het nomadenbestaan voor de huidige generatie niet meer vanzelfsprekend is.;Tulpan
3.0;Kleinschalig en mooi vormgegeven, maar bij vlagen saai Italiaans drama dat zich afspeelt in het Bologna van 1938;Il Papà di Giovanna
1.5;Stompzinnig gedrag van mensen onder stress leidt tot weinig inlevingsvermogen en spanning.;The Haunting in Connecticut
2.0;Een impotente actiefilm die nog net niet verveelt.;X-Men Origins: Wolverine
4.5;Een juweeltje, deze mix van tedere kinderfilm en volwassen horror.;Let the Right One In
3.5;Parallelle universums van verstoorde relaties tussen kinderen en hun ouders aan weerszijden van de aardkloot. Het wachten is op de climax die de broodnodige verandering teweeg gaat brengen. Maar zal er werkelijk ooit iets veranderen?;Mammoth
2.5;Klein familiedrama met liefde op het eerste gezicht als vertrekpunt ontaardt in een bizar en gevleugeld verhaal. Een flink driehoog-achtergehalte.;Ricky
3.0;Clive Owen is opnieuw sterk in zeer redelijke thriller.;The International
4.0;Verfrissende en heerlijk komische Belgische film met cabaretier Wim Helsen in de hoofdrol als schuwe en onbeduidende stuntelaar Diego Willems.;Dirty Mind
