4.0;Tragikomedie over de zoektocht naar jezelf in een wereld vol verwachtingen.;Matterhorn
3.0;Regisseur Matteo Garrone (Gomorra) trapt met deze satire open deuren in.;Reality
2.0;Dit zooitje mag dan wel door Quentin Tarantino gepresenteerd worden, verder is het een heel slap aftreksel van Kill Bill.;The Man with the Iron Fists
2.0;Een rommelige jeugdboekverfilming over een tiener die een verstoorde gezinssituatie verruilt voor het saaie hoge noorden.;Ice Dragon
4.5;Steven Spielberg behandelt een uiterst boeiende episode uit de Amerikaanse geschiedenis. Niemand past de hoge vilten hoed beter dan Daniel Day-Lewis.;Lincoln
3.5;Robert Zemeckis laat de special effects grotendeels links liggen in dit solide drama over een alcoholistische piloot. Zowel het vliegtuig als het verhaal heeft wat opstartproblemen.;Flight
4.0;Kill List is een spannende en onvoorspelbare mix tussen horror, thriller en misdaadfilm. Regisseur Ben Wheatley is een naam om in de gaten te houden.;Kill List
4.0;No is geslaagd als film en als tijdschets van een historisch bewogen periode.;NO
2.5;Dit officieuze vervolg op Costa met een sprankje Alles Is Liefde laat precies zien waar Johan Nijenhuis goed in is. Het zijn vooral de oudere acteurs die smaak en kleur aan het geheel geven.;Verliefd op Ibiza
4.0;In deze Britse zwarte komedie ontaardt oubollige caravantrip over het platteland in slachting.;Sightseers
3.5;De peuterende en kleuterende doelgroep zal zich uitstekend vermaken met nijntjes eerste bioscoopavontuur. Regisseur Hans Perk heeft zich echter flink vergist in hun aandachtsspanne.;Nijntje de film
5.0;Pure perfectie.;The Master
4.0;Een enerverende film over de jacht op Bin Laden die tegelijk vragen oproept over de zin en waarde van de missie.;Zero Dark Thirty
1.5;Van dik hout zaagt men planken en dat geldt zeker voor Texas Chainsaw. De zoveelste toevoeging aan de horrorfranchise rammelt aan alle kanten.;Texas Chainsaw
1.5;Komedie over de ups en downs van een meisje dat bij een bookmakerkantoor komt te werken.;Lay the Favorite
4.0;Kan Tarantino met zijn langverwachte western het succes van Inglourious Basterds herhalen?;Django Unchained
4.0;Een luchtige, maar oprechte film die zijn onderwerp en personages, mooi ingevuld door John Hawkes en Helen Hunt, serieus neemt.;The Sessions
3.5;Het meeslepende, waargebeurde verhaal van een gezin tijdens de tsunami van 2004 brengt vooral het beste in de hoofdrolspelers naar boven.;The Impossible
3.5;De derde absurde komedie van Japanner Hitoshi Matsumoto is wellicht niet zijn beste, maar vormt een aardige kennismaking met zijn geniaal gestoorde oeuvre.;Scabbard Samurai
4.0;Aangrijpend speelfilmdebuut van Peter Monsaert dat begeleid wordt door een uitstekende soundtrack van de mannen van Triggerfinger.;Offline
2.0;Nicolas Cage moet zijn dochter zien te redden. Denk aan Taken, maar dan veel slechter.;Stolen
2.0;Dit lichtkomische drama uit Uruguay communiceert indirect. 25 Watts-regisseur Pablo Stoll moet alle zeilen bijzetten om zijn introverte personages aan de praat te krijgen.;Très
3.5;Les Misérables is groots opgezet en heeft een cast die zowel acterend als zingend overtuigt, maar is vaak iets te bombastisch en sentimenteel voor zijn eigen goed.;Les Misérables
3.0;De prachtig aangeklede, goed geacteerde gangsteractie wordt in de weg gezeten door de mager uitgewerkte personages en de verwoede pogingen à la Tarantino cool te doen.;Gangster Squad
3.0;Lichtkomisch, historisch drama gezien door de ogen van de maîtresse van Franklin D. Roosevelt. De grootste troef is de charmante vertolking van Bill Murray als de president.;Hyde Park on Hudson
1.5;Een bovennatuurlijke thriller die zich afspeelt in een oud landhuis. Valt daar nog eer aan te behalen?;The Awakening
2.5;Frans drama waarin het voor de hoofdpersoon alleen maar armoediger en uitzichtlozer wordt. De vraag is of het de kijker veel kan schelen.;Une Vie Meilleure
3.0;Een Japans drama van de vermaarde Iraanse cineast Abbas Kiarostami over de bijzondere band tussen een meisje en een oudere heer.  Lief en ingetogen, maar niet helemaal consequent.;Like Someone In Love
4.0;Nog altijd even charmant en ontroerend als tien jaar geleden. De 3D voegt alleen niet veel toe.;Finding Nemo 3D
2.0;De Vikingthriller van Lasse Hallström is een plotmatig rommeltje. De ruwe visuele toon en de nadruk op de mannelijke karakterontwikkelingen gaan niet samen.;The Hypnotist
2.5;Een muzikale komedie met duidelijke pieken en dalen.;Pitch Perfect
4.0;Eerste deel van een trilogie over de vrouw en de wanhoop van haar bestaan. Op ruwe, liefdeloze wijze verbeeldt de regisseur van Hundstage het Keniaanse sekstoerisme.;Paradies: Liebe
2.0;Het duistere stadje heeft ditmaal meer mist, enge wezens en slachtpartijen, maar minder sfeer dan de voorganger.;Silent Hill: Revelation
3.0;Tom Cruise luidt het Nederlandse bioscoopjaar uit, maar niet met een daverende knal.;Jack Reacher
4.0;Hoe langer je nadenkt over deze visueel indrukwekkende film, hoe roerender en aangrijpender hij wordt.;Life of Pi
2.0;Het acteerwerk van Jan Smit is nog het minst grote probleem van deze Titanic-kloon. De finale kan niet meer goed maken dat de oorlog is gedegradeerd tot bijzaak.;Het Bombardement
5.0;De musicalklassieker, nu fantastisch gerestaureerd. Een recensie met een persoonlijk tintje.;West Side Story
1.0;Inspiratieloze komedie is grappig noch geloofwaardig.;So Undercover
4.0;Intrigerend en enthousiasmerende muziekdocumentaire over de mythische Amerikaanse zanger Rodriguez. Hij maakte slechts twee albums maar is een ster in Zuid-Afrika.;Searching for Sugar Man
2.5;Franse sociale komedie wil veel, maar blijft hangen in middelmatigheid.;Du Vent dans Mes Mollets
1.5;Een weinig geslaagde mix van drama, komedie en romantiek van de maker van The Pursuit of Happyness. Deze slappe hap speelt de volle honderd minuten op safe.;Playing for Keeps
2.5;Een mooi vormgegeven en dynamische animatiefilm die door zijn cartooneske stijl alleen voor de doelgroep te genieten zal zijn.;Hotel Transsylvanië: Hotel vol Monsters
3.5;Film van gebroeders Taviani laat fictie en realiteit in elkaar overvloeien.;Caesar Must Die
4.0;Een regelmatig hilarische, zelfbewuste genresatire van de maker van In Bruges.;Seven Psychopaths
2.0;Een gewaagde, maar ongelukkige combinatie tussen thriller en familiedrama. De spanning schittert door afwezigheid.;Deadfall
3.0;Ouderwetse kinderanimatiefilm met charmant verhaal;Ernest & Célestine
2.5;Nodeloos ingewikkeld, maar desondanks prima te volgen drieluik waarin het beroep van schrijver centraal staat. Alleen de verhaallijn over een plagiërend auteur is echt de moeite waard.;The Words
3.0;Van Groeningens muzikale drama laat wat steekjes vallen.;The Broken Circle Breakdown
4.0;Jackson slaat een overtuigende brug tussen twee trilogieën. The Hobbit is een oogstrelend spektakelstuk. Technisch nóg vooruitstrevender, maar de authentieke sfeer is gebleven.;The Hobbit: An Unexpected Journey
4.5;Met Wreck-It Ralph kan Disney zich meten met het beste werk van Pixar. Wreck-It Ralph is grappig, hartverwarmend en enorm vermakelijk.;Wreck-It Ralph
4.0;Een zeer innemende Nederlandse jeugdfilm die humor en drama vakkundig weet te verweven. Hoofdrolspelertje Maas Bronkhuyzen blijkt een ware ontdekking.;De Groeten van Mike!
2.0;Onbedoeld satirische actiethriller mist een held.;Alex Cross
5.0;Dankzij de theatrale stijl is deze magistrale verfilming van Tolstoj een gewaagde nieuwe adaptatie van het literaire meesterwerk.;Anna Karenina
4.0;Een intrigerend kunstenaarsportret waarbij de geportretteerde een enigma blijft, maar zijn werk voor zich spreekt.;Sol LeWitt
2.0;Een film die niet terugdeinst voor duistere themas of expliciete seksscènes, maar verzuimt concrete vragen te stellen of een logisch verhaal te vertellen.;Notre Paradis
3.5;Ben Sombogaart en zijn schrijvers hebben het klassieke jeugdboek van Jan Terlouw flink aangepakt, maar zijn de essentie en kracht ervan niet uit het oog verloren.;Koning van Katoren
3.0;Dit imposante mammoetproject van de haast onverfilmbare roman zet vooral het brein aan het werk en niet het hart. Visueel overdonderend, maar emotioneel wisselvallig en onbeduidend.;Cloud Atlas
4.5;Misschien niet de revolutionaire genrevernieuwer waar sommigen op hopen, maar wel simpelweg een van de meest enerverende films van het jaar.;Looper
4.0;In een stad waar alle levenslust verdwenen is, is een winkel die handelt in zelfmoord een noodzaak. Galgenhumor van Patrice Leconte.;Le Magasin des Suicides
4.0;Werner Herzog weet wel raad met 3D en sleept de kijker dertigduizend jaar mee terug in de tijd.;Cave of Forgotten Dreams
1.5;Spijtig maar waar: Clint Eastwood maakt een film te veel.;Trouble with the Curve
3.5;Een amusante lichtvoetige Franse romkom die zich afspeelt in het Mad Men-tijdperk. De veelzijdige Déborah François is verrukkelijk als sneltikkende secretaresse.;Populaire
3.5;Deze oogstrelende animatiefilm uit de DreamWorks-stal loopt niet helemaal geolied wat verhaalopbouw betreft. Het visuele plaatje en de actiescènes maken echter veel goed;Rise of the Guardians
2.0;Het vervolg op de kaskraker uit 2008 is meer van hetzelfde. Dat zal de liefhebber toejuichen, maar het verhaal staat bol van de onwaarschijnlijkheden en overdreven actie.;Taken 2
3.5;De nieuwste film van een ietwat absurdistische maar overduidelijk maatschappelijk betrokken filmmaker, aan wie EYE een retrospectief wijdt.;Nema Aviona za Zagreb
4.0;Vervolg op Alles is Liefde is eigenlijk helemaal geen vervolg, maar kan prima op zichzelf staan.;Alles is Familie
4.0;Indrukwekkend Roemeens drama van de regisseur van 4 Maanden, 3 Weken & 2 Dagen over de invloed van het geloof op een innige vriendschap.;Beyond the Hills
3.5;Documentaire in roadmovievorm benadert problemen Italië met humor en liefde voor het land.;Italy: Love It or Leave It
2.0;Teleurstellende ecohorror van de Oscarwinnende maker van Rain Man, die zich verliest in een overdaad aan visuele foefjes en hierbij de gouden regels van het genre uit het oog verliest.;The Bay
1.0;Zelfs als je je eraan probeert over te geven moet je tot de conclusie komen dat deze documentaire over een leeglopend gebied in Zwitserland tergend langzaam en saai is.;Die Kinder vom Napf
2.0;De nieuwe film van Jos Stelling kreeg de hoofdprijs op het Nederlands Film Festival, maar stelt flink teleur.;Het Meisje en de Dood
2.5;De nieuwste film van John Hillcoat heeft een prachtige aankleding en een cast vol aansprekende namen maar mist focus.;Lawless
3.0;Onheilspellende horrorthriller die het met een handvol perfect getimede schrikmomenten eerder moet hebben van zijn effectiviteit dan van zijn inventiviteit.;Sinister
3.5;Michael Haneke bewijst opnieuw zijn kwaliteit maar kan iemand de man alsjeblieft een wat strakkere editor toewijzen?;Amour
2.0;Vaardig gemaakte, maar levenloze afsluiter van de Twilight-serie zal alleen liefhebbers van de reeks bekoren.;The Twilight Saga: Breaking Dawn - Part 2
4.0;Een sterk geacteerd drama over armoede in de nabijheid van rijkdom, dat echter vooral interessant is door de familierelaties.;Sister
4.5;De derde speelfilm van regisseur Ben Affleck is een ijzersterk geacteerde mix van drama, politiek en een klein beetje humor gevangen is een treffend tijdsbeeld. De finale is zenuwslopend.;Argo
3.0;Niets nieuws onder de zon, maar een degelijke hoofdrol van de altijd goede Jennifer Lawrence houdt House at the End of the Street prima overeind.;House at the End of the Street
4.0;Krachtig Oostenrijks debuut over een gedetineerde jongen die van de vrijheid mag proeven, maar eerst op zoek moet naar zichzelf en antwoorden. Hij laat hierbij langzaam de kijker toe.;Atmen
2.5;Potentie heeft de nieuwste film van Lee Daniels zeker, maar het komt allemaal niet goed uit de verf.;The Paperboy
2.5;Internationale productie met een Nederlands tintje viel al in de prijzen bij het 26e Cinekidfestival.;Milo
3.5;Eindelijk een film die optimistisch is over de aanwezigheid van robots. Het enige negatieve is dat ze iemand in een oude criminele gewoonte laten terugvallen.;Robot & Frank
4.5;James Bond is weer relevant in een mooi geschoten actiefilm die zowel naar het verleden als de toekomst kijkt.;Skyfall
4.5;William Friedkin is terug, en dat zullen we weten ook. Killer Joe is zeker geen kost voor tere zielen. Maar wie tegen een stootje kan, mag deze keiharde misdaadthriller niet missen.;Killer Joe
3.5;Thomas Vinterberg is back on track met dit wrange drama over een man voor wie het leven een hel wordt als hij ten onrechte van kindermisbruik wordt beschuldigd.;Jagten
2.0;Zelfs met twee regisseur aan boord weet deze biopic over surfer Jay Moriarity niet te beklijven. De schrijvers staren zich blind op de bank tussen Moriarity en goeroe Frosty.;Chasing Mavericks
2.0;Wat de voordelen zijn van het muurbloempjesbestaan? Geen idee. Misschien anderhalf uur ongegeneerd hipsterwijsheden verkondigen?;The Perks of Being a Wallflower
2.0;Losse biopic over een plattelandskokkin die voor de Franse president mag gaan koken. De verwoede pogingen om parallellen tussen heden en verleden te trekken pakken averechts uit.;Haute Cuisine
4.0;Zeitlin levert met zijn debuut één van de meest filmische verrassingen van het jaar af.;Beasts of the Southern Wild
4.0;Dit derde regieproject van de schrijver van Training Day combineert documentaireachtige actie met doordachte personages. De interactie tussen Gyllenhaal en Peña is ijzersterk.;End of Watch
4.5;Een harde, ijzersterke gangsterfilm die de Amerikaanse droom aan diggelen schiet.;Killing Them Softly
4.0;Een sfeervol familiedrama over het Iran van toen en nu, met zowel politieke als thrillerelementen.;A Respectable Family
3.5;De derde avondvullende stop motion animatiefilm van Tim Burton mist een gestroomlijnd plot, maar is wederom vergeven van liefde, vakwerk en originele vondsten.;Frankenweenie
4.0;Spannend Nederlands drama met indrukwekkende cast over de internationale gevolgen van de economische crisis.;The Domino Effect
4.0;Van deze oude verstokte Rotterdammers die de marathon willen lopen om hun hachje te redden ga je ogenblikkelijk houden.;De Marathon
2.0;s Werelds bekendste Galliërs keren terug voor een clichématige herhalingsoefening in Groot-Brittannië.;Asterix & Obelix bij de Britten
4.0;Een goede rol van Karl Urban en keiharde actie maken van Dredd een geslaagde nieuwe verfilming van de strip.;Dredd
4.0;Wat is echt? Regisseur Ozon weet continu zijn kijker op geraffineerde wijze op het verkeerde been te zetten.;Dans la Maison
3.0;Politieke satire is een uitputtingsslag tussen twee rivaliserende senaatskandidaten waarbij alles geoorloofd is. Helaas gaan de scherpe toon en vaart er gaandeweg uit.;The Campaign
2.0;Twijfelachtige humor en voor de hand liggende stereotypes kenmerken deze op jongeren gerichte boekverfilming.;Alleen Maar Nette Mensen
1.5;Engelse bruiloftsfilm leent het scenario van The Hangover, maar dan zonder de humor.;A Few Best Men
4.0;Intens en dromerig drama over het lot van zwangere meisjes in het katholieke Vlaanderen eind jaren zeventig. Ongrijpbaar en invoelbaar tegelijk.;Little Black Spiders
2.5;Repetitieve documentaire over het bijzondere muzikale leven van dirigent, organist en klavecimbelspeler Ton Koopman en zijn relatie met zijn vrouw Tini Mathot.;Ik Wil Graag Honderd Worden
3.0;De doelgroep van jonge meisje wordt volledig in de watten gelegd met de kleurrijke personages en magische werelden. In die opzet is dit vijfde Tinker Bell-deel uitstekend geslaagd.;Tinker Bell: Het Geheim van de Vleugels
2.0;Deel drie in de Mijn Vader Is een Detective-reeks sleept er een talentenjacht bij om de kids te vermaken. Het is een rommeltje geworden dat niet kan kiezen tussen twee verhaallijnen.;The Battle
2.0;Milla Jovovich neemt het voor de vijfde keer op tegen hordes bloeddorstige zombies in het nieuwste deel van de populaire actiefranchise.;Resident Evil: Retribution
3.0;Het welbekende Lost in Translation-gevoel in een constante geur van vis.;Silent City
4.0;Wanneer het dikkerdje van een vriendinnengroep als eerste gaat trouwen, breekt de hel los.;Bachelorette
4.0;Een lofzang op mode-, stijl- en tijdschriftenicoon Diana Vreeland, zonder wie er nooit een Anna Wintour zou zijn geweest. Een intrigerend document van een fascinerende vrouw.;Diana Vreeland: The Eye Has to Travel
2.5;Jason Bourne in de polder: Hoezeer Daan Schuurmans ook zijn best doet, Bellicher: Cel verzandt in simplisme en knulligheid.;Bellicher: Cel
2.5;Een verfilming van het klassieke verhaal die technisch zowel overweldigend als enorm frustrerend is.;Faust
2.0;Dakota Fanning met een Brits accent is nog het minste probleem van dit veilige, vermijdende jeugddrama over een meisje aan het eind van haar leven.;Voor Ik Doodga
3.5;In het aarzelende begin ligt de nadruk te sterk op lichtvoetige humor, maar daarna weet deze jeugdboekenverfilming zich tijdig te herpakken.;Mees Kees
4.0;Spannende avonturenfilm over de zoektocht van een dertienjarige jongen naar de geschiedenis van zijn overleden moeder, wordt opgeluisterd door internationale sterrencast.;Nono, het Zigzag Kind
2.5;De Club van Sinterklaas krijgt zijn eigen bioscoopfilm. Helaas zijn de avonturen zouteloos en is het verhaal, alleen al door het vele gesponsorde snoepgoed, vooral te zoet.;De Club van Sinterklaas & Het Geheim van de Speelgoeddokter
4.0;Meryl Streep en Tommy Lee Jones zijn lekker op dreef als een ingekakt seksloos echtpaar. Het resultaat is een sensitief drama dat minder komisch en plat is dan de trailer suggereert.;Hope Springs
3.5;Oliver Stone doet waar hij goed in is met deze ouderwets brute film vol bekende gezichten.;Savages
2.5;Deze verfilming van de autobiografie van schrijver Nick Flynn mag zich verheugen op een imposante cast, maar weet er door het gebrek aan focus weinig bijzonders van te brouwen.;Being Flynn
2.5;Tragikomisch familiedrama van Susanne Bier met sterk acteerwerk, waarin een van kanker herstelde kapster een band opbouwt met de vader van haar aanstaande schoonzoon.;Love Is All You Need
4.0;Een fascinerende en gevarieerde documentaire van eigen bodem over alle aspecten van de mossel. Het doet je met andere ogen kijken naar het schelpdier.;L'Amour des Moules
1.5;Het zal geen verrassing zijn dat deze haaienhorror niet kan tippen aan Jaws, maar de klassieker van Steven Spielberg heeft de Australische makers ook niet kunnen inspireren lijkt het.;Bait
3.0;Een film over het uitkomen van familiegeheimen en de zoektocht naar je eigen ik.;Simon
3.0;Een degelijke, weinig opmerkelijke spionagethriller waarin een Ierse vrouw gedwongen wordt haar eigen familie te bespioneren.;Shadow Dancer
3.5;Hoewel Dolans pronkende stijl af en toe weer de overhand krijgt, komt zijn derde film solide en overtuigend over. Vooral het acteerwerk is knap in dit transseksualiteitsdrama.;Laurence Anyways
2.0;Schoonfamilie op bezoek is altijd moeilijk, maar vooral als je ze niet kan verstaan.;2 Days in New York
2.0;De zoveelste tandeloze horrorfilm over een bezeten meisje.;The Possession
4.0;Hartverwarmende romantische komedie van de makers van Little Miss Sunshine over een door een schrijver gecreëerde droomvrouw die tot leven komt.;Ruby Sparks
4.0;Adrien Brody excelleert als getergde leraar in sterk, maar gitzwart drama van Tony Kaye, de regisseur van American History X.;Detachment
4.0;Een ongebruikelijke driehoekskomedie met als spil een bierzuipende, blowende, grofgebekte teddybeer.  Absurd, vreemd en uitermate komisch. Van de maker van Family Guy.;Ted
4.0;Indrukwekkende, vijftien uur lange documentaire over de filmgeschiedenis is niet zonder gebreken, maar desondanks een must voor elke filmliefhebber.;The Story of Film
2.0;Dit Franse gezinsdrama twijfelt al net zo veel aan zichzelf als de hierin opererende moeder die de wanhoop nabij is.;À Perdre la Raison
3.0;Ongrijpbaar en onheilspellend Stasidrama over een arts met vluchtplannen die voortdurend op haar hoede moet zijn in haar nieuwe woon- en werkomgeving.;Barbara
2.5;Filmisch reisverslag verzuimt aangehaalde thema's boeiend uit te werken.;Berliner Tagebuch
3.5;Sympathieke film met goed uitgewerkte personages weet veel te bereiken met weinig materiaal.;Your Sister's Sister
3.0;Een prima thriller met de gebruikelijke plotelementen van Saskia Noort die weinig bijzonders te bieden heeft, maar ook niet veel fout doet.;De Verbouwing
3.0;Tony Gilroy heeft veel gepraat en uitleg nodig om dit nieuwe deel uit de reeks op gang te brengen, maar zorgt evengoed voor een degelijke actiethriller.;The Bourne Legacy
4.0;Ken Loach doet weer waar hij het best in is: kleine verhalen vertellen over mensen die het niet meezit.;The Angel's Share
2.5;Puberale animatiefilm van Deense makelij parodieert er lustig op los en spreekt zo zowel jongeren als volwassenen aan. Het levert een mix van leuke vondsten en missers op.;Ronal the Barbarian
3.0;Degelijkheid troef in dit familiedrama waarin een Turks tienermeisje wordt uitgehuwelijkt aan een immigrantengezin in Oostenrijk.;Kuma
4.0;Vreemdgaan of niet vreemdgaan. Dat is de vraag waar Michelle Williams over tobt in Take This Waltz.;Take This Waltz
3.5;God Bless America is wraakfilm, roadmovie en satire ineen: inktzwarte humor met scherpe maatschappijkritiek.;God Bless America
4.0;Speelfilmregiedebuut van rapper Plan B is een rauw en realistisch misdaaddrama met een sterke, soundtrack.;Ill Manors
3.5;Een intrigerend portret van de Nederlandse sport- en hobbyvisserij.;V.I.S.S.E.N
2.0;Michael Winterbottom probeert een klassieke roman modern en Bollywoodachtig te verfilmen. Het experiment faalt jammerlijk door de onevenwichtige aanpak.;Trishna
2.5;Rodrigo Cortés opvolger van Buried kan niet kiezen tussen drama of thriller en valt tussen wal en schip.;Red Lights
3.0;Dax Shepards tweede film is een wisselvallige actiekomedie die gered wordt door een enthousiaste cast.;Hit & Run
4.0;Intens oorlogsdrama over een Afrikaanse kindsoldaat die zich probeert vrij te vechten van haar ontvoerders en de liefde vindt.;Rebelle
2.0;Sciencefictionkomedie die profiteert van de aanwezigheid van Ben Stiller en Vince Vaughn, maar te vaak vervalt in banale grappen.;The Watch
3.0;Woody Allen zet zijn affaire met Europa voort met Bella Roma!;To Rome with Love
4.0;Dit oerdegelijke Deense koningsdrama over een verboden verhouding aan het hof excelleert door de voortreffelijke vertolkingen. Het duurt wel even voor de boel op gang komt.;A Royal Affair
4.0;Een ontroerend, confronterend en herkenbaar verhaal over ouder worden.;A Simple Life
4.0;Bloed, zweet en een poging tot tranen.;The Expendables 2
3.0;Documentaire over geografische tegenpolen is visueel indrukwekkend en vakkundig in elkaar gezet, maar duurt desondanks te lang om de aandacht vast te blijven houden.;¡Vivan las Antipodas!
4.0;Een innemend en intrigerend document over de passie van een wereldberoemd fotograaf en de ontwikkeling van de fotografie door de jaren heen.;Journal de France
3.5;Een aangename ode aan de Europese liefde voor de Amerikaanse film in de vorm van een roadmovie.;Robert Mitchum Est Mort
4.0;Grappige en verbluffend mooi gemaakte stop-motion animatiefilm, die een ode brengt aan het horrorgenre... en toch geschikt is voor kinderen.;ParaNorman
3.5;Dit vervolg op de animatiefilm uit 2010 leunt een stuk minder op Finding Nemo en heeft veel meer een eigen karakter. De animaties zien er voor Europese begrippen schitterend uit.;Sammy 2
2.0;Een surrealistisch meesterwerk of een pretentieus rommeltje? Holy Motors is het misschien wel allebei. We laten twee recensenten met afwijkende meningen aan het woord.;Holy Motors
3.0;Een nieuwe verfilming van het verhaal van Philip K. Dick. Plot en actie vechten om de aandacht. De spectaculaire uitwerking van de laatste discipline bezorgt de film een voldoende.;Total Recall
4.0;Sympathieke pre-apocalyptische roadtripfilm, waarin het naderende einde van de wereld vanuit diverse hoeken wordt belicht op een wijze die zowel geestig als aangrijpend is.;Seeking a Friend for the End of the World
4.5;Het fascinerende Meek's Cutoff bewijst met eigentijdse arthousestijl en een vrouwelijk perspectief dat er nog steeds leven in de western zit.;Meek's Cutoff
2.5;Iedereen gaat vreemd in deze bij vlagen grappige komedie.;Les Infidèles
2.0;Een op papier interessant loopje met de historische werkelijkheid wordt volstrekt humorloos, enigszins moraliserend en zonder noemenswaardige spanning op de kijker afgevuurd.;Abraham Lincoln: Vampire Hunter
3.0;Lockout is een leuke, maar allesbehalve originele actiefilm. Gelukkig heeft hij een prima hoofdrolspeler in huis.;Lockout
1.5;Een quasistout verhaaltje dat zich afspeelt op een rockfestival. Gelukkig zit er genoeg goede muziek in verwerkt om de tijd mee te verdrijven.;You Instead
3.5;Een boeiend en subtiel verteld familiedrama met een sterk uitgewerkte metafoor.;House
2.0;Animatiefilm van IJslandse komaf is vooral te pruimen voor de kleine kijkertjes die zich niet zullen storen aan de matige kwaliteit.;THOR: De Legende van Walhalla
3.0;Een prima biografie van een van de grootste Europese popsterren ooit, waarop vooral valt af te dingen dat diens korte leven niet bijster interessant was.;Cloclo
1.5;Thriller die zich afspeelt in een pinhokje is zo spannend als een bankafschrift.;ATM
3.0;Deze komedie over de strijd van een sterrenchef om zijn drie Michelinsterren te behouden, mist pit en echte romantiek, maar is een lekker luchtig tussendoortje.;Comme un Chef
2.0;Vierde deel in de Step Up-reeks ziet er gelikt uit en heeft vlotte moves, maar het verhaal en de personages zijn nog altijd van ondergeschikt belang.;Step Up 4 Miami Heat
3.5;Inspirerende Franse film over het echte leven.;Les Neiges du Kilimandjaro
